{
  "name": "minimal-transaction",
  "contractVersion": "0.4-preview.2",
  "schemaVersion": "0.4-preview.1",
  "payloadSchemaId": "https://contracts.nireco.dev/comet-integration/0.4-preview.2/schemas/transaction.schema.json",
  "canonicalizationProfile": "nireco-canonical-json-0.1",
  "hashAlgorithm": "sha256",
  "hashInput": "payload",
  "expectedCanonicalSha256": "sha256:41ab9dc428896bde1e7004bdeee77668d0f538702300380e102736ac13938cd2",
  "payload": {
    "id": "018f0000-0000-7000-8000-000000000004",
    "target": {
      "uri": "nireco://workspace-01/document/DocCaseA",
      "baseRevisionId": "018f0000-0000-7000-8000-000000000001"
    },
    "actor": {
      "type": "human",
      "id": "user-0001"
    },
    "intent": "Append punctuation after an emoji using a UTF-16 offset.",
    "operations": [
      {
        "id": "018f0000-0000-7000-8000-000000000005",
        "type": "replace-text",
        "textNodeId": "018f0000-0000-7000-8000-000000000105",
        "startUtf16Offset": 8,
        "endUtf16Offset": 8,
        "replacement": "."
      }
    ],
    "preconditions": [
      {
        "kind": "node-exists",
        "nodeId": "018f0000-0000-7000-8000-000000000105"
      },
      {
        "kind": "schema-version",
        "expected": "1.0.0-preview.1"
      },
      {
        "kind": "document-hash",
        "expected": "sha256:6789e729fc0211ad97a052f37b9a834ec4b32df5f666e796b20b07cd1c28f96c"
      }
    ],
    "metadata": {
      "source": "human-input",
      "undoGroupId": "undo-0001"
    },
    "createdAt": "2026-07-16T16:00:00Z"
  }
}
